{
  "schema_version": 2,
  "scenarios": {
    "connection-settings": {
      "baseline": {
        "scores": [2, 1, 1, 2, 1, 2, 2, 2, 2, 1],
        "score_evidence": [
          {"category": 1, "score": 2, "evidence": ["baseline/connection-settings/evidence/runtime-uia.txt:3-24"], "uncertainty": "The required Korean fixture and all observed controls/text stayed inside the measured 420-DIP client; text scaling above 100 percent was not exercised."},
          {"category": 2, "score": 1, "evidence": ["baseline/connection-settings/generated/MainWindow.xaml:23-77"], "uncertainty": "The page has clear groups, but a field validation is promoted to a titled InfoBar and the automatic-reconnect subject is repeated as a separate heading plus switch content, weakening hierarchy."},
          {"category": 3, "score": 1, "evidence": ["baseline/connection-settings/generated/MainWindow.xaml:33-70"], "uncertainty": "The required native controls are present, but the simple inline field-validation role is represented by an InfoBar and the ToggleSwitch subject/state content is duplicated rather than using the cleaner native header pattern."},
          {"category": 4, "score": 2, "evidence": ["baseline/connection-settings/evidence/runtime-uia.txt:19-24"], "uncertainty": "ComboBox selection, ToggleSwitch state, tab traversal, validation transitions, and Save focus return were exercised; focus visual appearance was not separately inspected."},
          {"category": 5, "score": 1, "evidence": ["baseline/connection-settings/evidence/runtime-uia.txt:3-24"], "uncertainty": "Meaningful UIA names and keyboard operation were observed, but focus-visual, Narrator, Accessibility Insights, and explicit validation announcement/association were not verified."},
          {"category": 6, "score": 2, "evidence": ["baseline/connection-settings/evidence/runtime-uia.txt:3-18"], "uncertainty": "The required Korean content was rendered inside the measured 420-DIP client; text scaling above 100 percent was not exercised."},
          {"category": 7, "score": 2, "evidence": ["baseline/connection-settings/generated/MainWindow.xaml:1-80", "baseline/connection-settings/evidence/static-review.txt:16-21"], "uncertainty": "Native controls and theme resources are retained with no custom ControlTemplate; Light and High Contrast were not run."},
          {"category": 8, "score": 2, "evidence": ["baseline/connection-settings/evidence/runtime-uia.txt:19-24"], "uncertainty": "The scenario-specific TextBox, ComboBox, ToggleSwitch, and Button interactions were exercised successfully."},
          {"category": 9, "score": 2, "evidence": ["baseline/connection-settings/generated/MainWindow.xaml:33-77"], "uncertainty": "Persistent field labels, helper text, validation content, switch subject, and save action remain structurally distinct despite the over-emphasized validation component."},
          {"category": 10, "score": 1, "evidence": ["baseline/connection-settings/generated/MainWindow.xaml:23-77", "baseline/connection-settings/generated/MainWindow.xaml.cs:13-27"], "uncertainty": "The implementation is relevant and compact, but using a full InfoBar for field validation plus repeated switch labelling adds avoidable structure beyond the smallest clear form."}
        ],
        "defects": {"overflow": 0, "anatomy": 1, "accessibility": 0, "control_template": 0, "complexity": 1, "build_failures": 0, "render_failures": 0}
      },
      "guided": {
        "scores": [2, 2, 2, 2, 1, 2, 2, 2, 2, 2],
        "score_evidence": [
          {"category": 1, "score": 2, "evidence": ["guided/connection-settings/evidence/runtime-uia.txt:3-21"], "uncertainty": "All observed required controls and Korean text remained inside the measured 420-DIP client; text scaling above 100 percent was not exercised."},
          {"category": 2, "score": 2, "evidence": ["guided/connection-settings/generated/MainWindow.xaml:12-57"], "uncertainty": "The title, field/header, helper, validation, transport, switch, and primary save action are grouped without competing status UI."},
          {"category": 3, "score": 2, "evidence": ["guided/connection-settings/generated/MainWindow.xaml:18-57"], "uncertainty": "TextBox and ComboBox use native Header anatomy, the ToggleSwitch uses Header content, and validation is adjacent field text rather than an unrelated component."},
          {"category": 4, "score": 2, "evidence": ["guided/connection-settings/evidence/runtime-uia.txt:16-21"], "uncertainty": "Validation transitions, ComboBox popup/selection, ToggleSwitch state, tab traversal, and Save focus return were exercised; focus visual appearance was not separately inspected."},
          {"category": 5, "score": 1, "evidence": ["guided/connection-settings/generated/MainWindow.xaml:18-57", "guided/connection-settings/evidence/runtime-uia.txt:3-21"], "uncertainty": "Explicit accessible names, native roles, live validation, and keyboard operation are present, but focus-visual, Narrator, and Accessibility Insights verification were not performed."},
          {"category": 6, "score": 2, "evidence": ["guided/connection-settings/evidence/runtime-uia.txt:3-15"], "uncertainty": "Required Korean content was rendered within the measured 420-DIP client; text scaling above 100 percent was not exercised."},
          {"category": 7, "score": 2, "evidence": ["guided/connection-settings/generated/MainWindow.xaml:12-57", "guided/connection-settings/evidence/static-review.txt:12-18"], "uncertainty": "Native controls, built-in text/accent styles, and a ThemeResource critical brush are used with no custom ControlTemplate; Light and High Contrast were not run."},
          {"category": 8, "score": 2, "evidence": ["guided/connection-settings/evidence/runtime-uia.txt:16-21"], "uncertainty": "The required native control characteristics and transitions were exercised successfully."},
          {"category": 9, "score": 2, "evidence": ["guided/connection-settings/generated/MainWindow.xaml:18-57"], "uncertainty": "Header, helper, validation, switch subject, option values, and save label are clearly separated by role."},
          {"category": 10, "score": 2, "evidence": ["guided/connection-settings/generated/MainWindow.xaml:1-61", "guided/connection-settings/generated/MainWindow.xaml.cs:1-31"], "uncertainty": "The output uses only the requested native controls, one adjacent validation TextBlock, and two small event handlers without unrelated architecture."}
        ],
        "defects": {"overflow": 0, "anatomy": 0, "accessibility": 0, "control_template": 0, "complexity": 0, "build_failures": 0, "render_failures": 0}
      }
    },
    "device-list": {
      "baseline": {
        "scores": [1, 2, 2, 1, 1, 1, 2, 1, 2, 2],
        "score_evidence": [
          {"category": 1, "score": 1, "evidence": ["baseline/device-list/generated/MainWindow.xaml:55-119", "baseline/device-list/generated/MainWindow.xaml.cs:9-14"], "uncertainty": "Both required long fixtures and wrapping-oriented layout are present, but the compile failure prevented rendered 520-DIP verification; connection metadata also uses CharacterEllipsis."},
          {"category": 2, "score": 2, "evidence": ["baseline/device-list/generated/MainWindow.xaml:13-52", "baseline/device-list/generated/MainWindow.xaml:55-119"], "uncertainty": "The title/description, command surface, bold device name, secondary metadata, and empty-state explanation form a clear hierarchy."},
          {"category": 3, "score": 2, "evidence": ["baseline/device-list/generated/MainWindow.xaml:23-119"], "uncertainty": "Required native CommandBar, ListView item fields, single-selection structure, and empty state are present statically; the build failure is a data-model compatibility defect rather than missing anatomy."},
          {"category": 4, "score": 1, "evidence": ["baseline/device-list/generated/MainWindow.xaml:23-60", "baseline/device-list/generated/MainWindow.xaml.cs:22-49", "baseline/device-list/evidence/build.txt"], "uncertainty": "Selection/remove plumbing and dynamic overflow are represented statically, but the frozen project did not build so native selection, overflow, disabled state, and keyboard behavior were not exercised."},
          {"category": 5, "score": 1, "evidence": ["baseline/device-list/generated/MainWindow.xaml:23-60"], "uncertainty": "Native command labels and a named ListView are present, but item-level runtime naming, keyboard traversal, focus, and selected-state exposure could not be verified because the build failed."},
          {"category": 6, "score": 1, "evidence": ["baseline/device-list/generated/MainWindow.xaml:69-95", "baseline/device-list/generated/MainWindow.xaml.cs:9-14"], "uncertainty": "Both Korean and English long fixtures exist in source, but 520-DIP rendering and text scaling were not verified because the build failed."},
          {"category": 7, "score": 2, "evidence": ["baseline/device-list/generated/MainWindow.xaml:1-122", "baseline/device-list/evidence/static-review.txt:18-18"], "uncertainty": "Native CommandBar/ListView controls and theme resources are used without custom ControlTemplate or fixed-color replacement."},
          {"category": 8, "score": 1, "evidence": ["baseline/device-list/generated/MainWindow.xaml:23-60", "baseline/device-list/generated/MainWindow.xaml.cs:38-49", "baseline/device-list/evidence/build.txt"], "uncertainty": "Dynamic overflow, single selection, and selection-driven Remove state are implemented statically, but the exact typed x:Bind item model prevents build and therefore component behavior cannot be verified."},
          {"category": 9, "score": 2, "evidence": ["baseline/device-list/generated/MainWindow.xaml:69-118"], "uncertainty": "Device name, connection label/value, status label/value, and empty-state explanation are separated clearly."},